"DESCRIPTION","DURATION IN MS","NAME","PARENT SUITE","START TIME","STATUS","STOP TIME","SUB SUITE","SUITE","TEST CLASS","TEST METHOD"
"","1563","Move an existing item into an already created folder","tests.folder","Thu Jun 12 09:30:35 GMT 2025","passed","Thu Jun 12 09:30:37 GMT 2025","","test_folder_job","",""
"","0","Description field can remain empty","tests.freestyle_project","Thu Jun 12 09:32:07 GMT 2025","passed","Thu Jun 12 09:32:07 GMT 2025","","test_description_freestyle_project","",""
"","56","test_each_trigger_opt_enable[pseudoRemoteTrigger]","tests.freestyle_project","Thu Jun 12 09:33:01 GMT 2025","passed","Thu Jun 12 09:33:01 GMT 2025","","test_freestyle_config_trigger_verif","",""
"","469","The user should be able to select Environment options","tests.freestyle_project","Thu Jun 12 09:32:56 GMT 2025","passed","Thu Jun 12 09:32:56 GMT 2025","","test_environment_set_freestyle_project","",""
"","719","test_set_description_for_multi_config_project","tests.multi_configuration_project_configuration","Thu Jun 12 09:36:03 GMT 2025","passed","Thu Jun 12 09:36:04 GMT 2025","","test_set_description","",""
"","142","Disappear a warning message on the Project page","tests.multi_configuration_project_configuration","Thu Jun 12 09:35:48 GMT 2025","passed","Thu Jun 12 09:35:48 GMT 2025","","test_enable_or_disable_the_project","",""
"Verify that the load statistics graph is displayed according to the selected timespan.","1761","Display graph according to the selected Timespan","tests.manage_jenkins.status_information","Thu Jun 12 09:34:51 GMT 2025","passed","Thu Jun 12 09:34:53 GMT 2025","","test_load_statistics","",""
