"DESCRIPTION","DURATION IN MS","NAME","PARENT SUITE","START TIME","STATUS","STOP TIME","SUB SUITE","SUITE","TEST CLASS","TEST METHOD"
"","0","If no SCM is selected, the project should still be creatable","tests.freestyle_project","Wed Jun 11 00:32:43 GMT 2025","passed","Wed Jun 11 00:32:43 GMT 2025","","test_scm_freestyle_project","",""
"","1849","Tooltips for all SCM options should be available","tests.freestyle_project","Wed Jun 11 00:33:21 GMT 2025","passed","Wed Jun 11 00:33:22 GMT 2025","","test_scm_freestyle_project","",""
"Verify that the show/hide all values buttons work properly on the System Properties tab.","3353","System Properties tab - show/hide all values","tests.manage_jenkins.status_information","Wed Jun 11 00:33:58 GMT 2025","passed","Wed Jun 11 00:34:02 GMT 2025","","test_system_information","",""
"","388","Disable trigger checkboxes by clicking label","tests.pipeline","Wed Jun 11 00:36:54 GMT 2025","passed","Wed Jun 11 00:36:55 GMT 2025","","test_build_triggers","",""
"Verify that only one project type can be selected at a time on the New Item screen.","903","Only one project type can be selected","tests.new_item","Wed Jun 11 00:36:10 GMT 2025","passed","Wed Jun 11 00:36:11 GMT 2025","","test_select_an_item_type","",""
